{
  "schema": "direct_codex_odeu_profile@1",
  "profileId": "chatgpt_codex_subscription_oai_server_baseline_2026_04_25",
  "profileVersion": 1,
  "backendContractVersion": "imported-baseline.openai-docs-and-local-specs.2026-04-25",
  "observedAt": "2026-04-25T22:45:00Z",
  "source": "imported-baseline",
  "subject": {
    "name": "ChatGPT subscription Codex backend path",
    "provider": "OpenAI / ChatGPT Codex",
    "compatibilityTier": "native",
    "description": "Profile of the currently documented and specimen-observed OpenAI server-side allowances for Codex usage through ChatGPT subscription authentication. This is not an OpenAI Platform API profile and not a live-probed credentialed extraction."
  },
  "scope": {
    "inScope": [
      "ChatGPT sign-in path for Codex subscription access.",
      "Observed/direct Codex Responses-style backend path at chatgpt.com/backend-api/codex/responses.",
      "Official Codex app-server capabilities relevant to client harnesses, distinguished from raw OAI backend authority.",
      "Model, input, response-event, reasoning, tool-call, continuation, quota, retry, and security allowances that can gate a future direct harness."
    ],
    "outOfScope": [
      "Consumer ChatGPT web-thread API automation.",
      "OpenAI Platform API entitlement or billing profile.",
      "Public production API promise for chatgpt.com/backend-api/codex/responses.",
      "Any live OAuth exchange or live model call.",
      "Deep ADEU-native fork internals as default standalone-shell UX."
    ],
    "authorityLayerNotes": [
      "OAI server-side allowances include model inference, Responses-style stream events, auth/quota classification, and hosted backend limits.",
      "Codex app-server allowances are official client-harness protocol surfaces but are partly local harness/server functions rather than direct cloud endpoint powers.",
      "Workspace reads, shell commands, patch application, and local tool execution remain local harness or workspace-backend authority, not an OAI server permission."
    ]
  },
  "ontology": {
    "transports": [
      {
        "id": "transport.sse.responses",
        "name": "SSE over HTTP POST Responses-style stream",
        "status": "observed",
        "authorityLayer": "chatgpt-subscription-backend",
        "summary": "The direct subscription path is specified as SSE over fetch for phase 1 and the public Codex article says ChatGPT login uses the Codex Responses endpoint.",
        "evidence": [
          {
            "sourceId": "direct-path-spec",
            "grade": "local-spec",
            "summary": "Direct spec requires phase-1 SSE and isolates raw stream events below a normalizer."
          },
          {
            "sourceId": "openai-unrolling-codex",
            "grade": "official-engineering-note",
            "summary": "OpenAI says ChatGPT login uses chatgpt.com/backend-api/codex/responses for Codex CLI inference."
          }
        ],
        "notes": [
          "Accept for probes and fixture normalizers; require live probe before default direct-harness exposure."
        ]
      },
      {
        "id": "transport.websocket.responses",
        "name": "Responses WebSocket parity",
        "status": "unstable",
        "authorityLayer": "chatgpt-subscription-backend",
        "summary": "WebSocket may exist or be used by Codex, but direct profile treats it as a later parity target after SSE baseline.",
        "evidence": [
          {
            "sourceId": "direct-path-spec",
            "grade": "local-spec",
            "summary": "WebSocket is phase 2 only if it materially improves latency or continuity."
          },
          {
            "sourceId": "codex-app-server-docs",
            "grade": "official-doc",
            "summary": "App-server WebSocket transport is experimental and unsupported for the local JSON-RPC protocol."
          }
        ],
        "notes": [
          "Do not make this the first direct-harness default."
        ]
      },
      {
        "id": "transport.app_server_stdio",
        "name": "Codex app-server stdio JSONL",
        "status": "accepted",
        "authorityLayer": "codex-app-server",
        "summary": "Official app-server supports stdio JSONL as the default JSON-RPC transport for rich clients.",
        "evidence": [
          {
            "sourceId": "codex-app-server-docs",
            "grade": "official-doc",
            "summary": "Supported transports include stdio as default JSONL."
          }
        ]
      },
      {
        "id": "transport.app_server_websocket",
        "name": "Codex app-server WebSocket JSON-RPC",
        "status": "unstable",
        "authorityLayer": "codex-app-server",
        "summary": "Official app-server supports WebSocket frames but marks the transport experimental and unsupported.",
        "evidence": [
          {
            "sourceId": "codex-app-server-docs",
            "grade": "official-doc",
            "summary": "WebSocket transport is experimental/unsupported and should use auth if non-loopback."
          }
        ]
      }
    ],
    "authSurfaces": [
      {
        "id": "auth.chatgpt_managed",
        "name": "ChatGPT managed sign-in",
        "status": "accepted",
        "authorityLayer": "oai-server",
        "summary": "Codex supports signing in with ChatGPT for subscription access; CLI and IDE extension cache and refresh credentials.",
        "evidence": [
          {
            "sourceId": "codex-auth-docs",
            "grade": "official-doc",
            "summary": "Codex supports ChatGPT sign-in for subscription access and refreshes tokens automatically during use."
          }
        ]
      },
      {
        "id": "auth.chatgpt_device_code",
        "name": "ChatGPT device-code sign-in",
        "status": "accepted",
        "authorityLayer": "oai-server",
        "summary": "Headless/remote ChatGPT sign-in can use a device-code flow when enabled.",
        "evidence": [
          {
            "sourceId": "codex-auth-docs",
            "grade": "official-doc",
            "summary": "Device-code login is documented for headless situations."
          }
        ]
      },
      {
        "id": "auth.chatgpt_external_tokens",
        "name": "Externally managed ChatGPT tokens",
        "status": "unstable",
        "authorityLayer": "codex-app-server",
        "summary": "App-server has an experimental external token mode where host apps supply ChatGPT tokens and answer refresh requests.",
        "evidence": [
          {
            "sourceId": "codex-app-server-docs",
            "grade": "official-doc",
            "summary": "chatgptAuthTokens mode is experimental and refresh requests time out after about 10 seconds."
          }
        ],
        "notes": [
          "A direct harness must not fabricate tokens; renderer must never receive raw tokens."
        ]
      },
      {
        "id": "auth.api_key",
        "name": "OpenAI Platform API key",
        "status": "rejected",
        "authorityLayer": "oai-server",
        "summary": "API-key mode is documented for CLI/SDK/IDE, but this ODEU profile is specifically for ChatGPT subscription access, not Platform API access.",
        "evidence": [
          {
            "sourceId": "codex-auth-docs",
            "grade": "official-doc",
            "summary": "Codex supports API keys separately; API key usage follows Platform settings."
          },
          {
            "sourceId": "direct-path-spec",
            "grade": "local-spec",
            "summary": "Direct path is not an OpenAI Platform API integration."
          }
        ]
      }
    ],
    "models": [
      {
        "id": "gpt-5.5",
        "displayName": "GPT-5.5",
        "status": "observed",
        "availability": "Listed in current Codex pricing/docs for Plus/Pro/Business local messages; actual user availability must be discovered with model/list or live direct probe.",
        "contextWindow": null,
        "supportsReasoning": true,
        "supportedReasoningEfforts": [
          "low",
          "medium",
          "high",
          "xhigh"
        ],
        "supportsTools": true,
        "supportsImages": null,
        "notes": [
          "Per-model modalities and reasoning efforts must be treated as account/catalog-discovered, not hardcoded."
        ],
        "evidence": [
          {
            "sourceId": "codex-pricing-docs",
            "grade": "official-doc",
            "summary": "Plus includes latest models including GPT-5.5; limits table lists GPT-5.5 local messages."
          },
          {
            "sourceId": "codex-changelog",
            "grade": "official-doc",
            "summary": "GPT-5.5 is recommended for most Codex tasks when present in the picker."
          }
        ]
      },
      {
        "id": "gpt-5.4",
        "displayName": "GPT-5.4",
        "status": "observed",
        "availability": "Listed for Plus/Pro/Business local messages and documented as available in Codex app/CLI/IDE/cloud.",
        "contextWindow": null,
        "supportsReasoning": true,
        "supportedReasoningEfforts": [
          "low",
          "medium",
          "high",
          "xhigh"
        ],
        "supportsTools": true,
        "supportsImages": true,
        "notes": [
          "Context window remains profile-unknown until model/list or live request exposes it for the account."
        ],
        "evidence": [
          {
            "sourceId": "codex-pricing-docs",
            "grade": "official-doc",
            "summary": "Codex Plus includes GPT-5.4."
          },
          {
            "sourceId": "codex-changelog",
            "grade": "official-doc",
            "summary": "GPT-5.4 is available everywhere Codex can be used; docs also mention 1M context experimental support."
          }
        ]
      },
      {
        "id": "gpt-5.4-mini",
        "displayName": "GPT-5.4-mini",
        "status": "observed",